{
  "connected_to_runtime": false,
  "created_at": "2026-07-27 00:00:00+00:00",
  "deck_id": "deck-plan-0ee17cfe60a9",
  "evaluation_result": {
    "blocking_issue_count": 0,
    "dimensions": [
      {
        "issues": [],
        "max_score": 10,
        "name": "Intent Clarity",
        "reason": "Average intent clarity across 12 slide intents.",
        "recommendations": [],
        "score": 10
      },
      {
        "issues": [],
        "max_score": 10,
        "name": "Visual Readiness",
        "reason": "Average visual readiness across 12 slide intents.",
        "recommendations": [],
        "score": 10
      },
      {
        "issues": [],
        "max_score": 10,
        "name": "Information Hierarchy",
        "reason": "Average information hierarchy across 12 slide intents.",
        "recommendations": [],
        "score": 10
      },
      {
        "issues": [],
        "max_score": 10,
        "name": "Reading Flow",
        "reason": "Average reading flow across 12 slide intents.",
        "recommendations": [],
        "score": 9
      },
      {
        "issues": [],
        "max_score": 10,
        "name": "Evidence Compatibility",
        "reason": "Average evidence compatibility across 12 slide intents.",
        "recommendations": [],
        "score": 10
      },
      {
        "issues": [],
        "max_score": 10,
        "name": "Message Compatibility",
        "reason": "Average message compatibility across 12 slide intents.",
        "recommendations": [],
        "score": 10
      },
      {
        "issues": [],
        "max_score": 10,
        "name": "Diagram Suitability",
        "reason": "Average diagram suitability across 12 slide intents.",
        "recommendations": [],
        "score": 10
      },
      {
        "issues": [],
        "max_score": 10,
        "name": "Chart Suitability",
        "reason": "Average chart suitability across 12 slide intents.",
        "recommendations": [],
        "score": 10
      },
      {
        "issues": [],
        "max_score": 10,
        "name": "Customer-facing Readiness",
        "reason": "Average customer-facing readiness across 12 slide intents.",
        "recommendations": [],
        "score": 10
      }
    ],
    "grade": "S",
    "max_score": 100,
    "note": "This score evaluates Slide Intent readiness only. It does not evaluate Slide Blueprint generation, layout, diagram rendering, chart rendering, typography, theme, PPTX output, API behavior, or sales outcome.",
    "total_score": 99,
    "warning_count": 0
  },
  "generated_charts": false,
  "generated_diagrams": false,
  "generated_pptx": false,
  "generated_slide_blueprints": false,
  "project_id": "planner-fixture-web-01",
  "project_name": "Manufacturing Website Renewal",
  "slide_intent_output_version": "pe2_slide_intent_output_v1",
  "slide_intents": [
    {
      "chart_candidate": "none",
      "connected_to_runtime": false,
      "created_at": "2026-07-27 00:00:00+00:00",
      "deck_id": "deck-plan-0ee17cfe60a9",
      "diagram_candidate": "image_placeholder",
      "evaluation_result": {
        "blocking_issue_count": 0,
        "dimensions": [
          {
            "issues": [],
            "max_score": 10,
            "name": "Intent Clarity",
            "reason": "Slide Intent must say what the viewer should understand or decide.",
            "recommendations": [],
            "score": 10
          },
          {
            "issues": [],
            "max_score": 10,
            "name": "Visual Readiness",
            "reason": "Slide Intent should provide enough abstraction for Visual Director to choose a visual pattern.",
            "recommendations": [],
            "score": 10
          },
          {
            "issues": [],
            "max_score": 10,
            "name": "Information Hierarchy",
            "reason": "Primary focus, secondary points, and muted content should be clearly separated.",
            "recommendations": [],
            "score": 10
          },
          {
            "issues": [],
            "max_score": 10,
            "name": "Reading Flow",
            "reason": "Reading order should describe how information should be scanned before rendering.",
            "recommendations": [],
            "score": 9
          },
          {
            "issues": [],
            "max_score": 10,
            "name": "Evidence Compatibility",
            "reason": "Visual intent must respect evidence gaps and avoid hiding missing proof.",
            "recommendations": [],
            "score": 10
          },
          {
            "issues": [],
            "max_score": 10,
            "name": "Message Compatibility",
            "reason": "Intent should be traceable to Message Designer output.",
            "recommendations": [],
            "score": 10
          },
          {
            "issues": [],
            "max_score": 10,
            "name": "Diagram Suitability",
            "reason": "Diagram candidate should be selected only when it clarifies the slide purpose.",
            "recommendations": [],
            "score": 10
          },
          {
            "issues": [],
            "max_score": 10,
            "name": "Chart Suitability",
            "reason": "Chart candidate should require numeric evidence and avoid fake numbers.",
            "recommendations": [],
            "score": 10
          },
          {
            "issues": [],
            "max_score": 10,
            "name": "Customer-facing Readiness",
            "reason": "Intent should be safe for customer-facing visual planning.",
            "recommendations": [],
            "score": 10
          }
        ],
        "grade": "S",
        "max_score": 100,
        "note": "This score evaluates Slide Intent readiness only. It does not evaluate Slide Blueprint generation, layout, diagram rendering, chart rendering, typography, theme, PPTX output, API behavior, or sales outcome.",
        "total_score": 99,
        "warning_count": 0
      },
      "generated_chart": false,
      "generated_diagram": false,
      "generated_pptx": false,
      "generated_slide_blueprint": false,
      "information_priority": {
        "density": "low",
        "emphasis": "main_message",
        "muted_content": [],
        "primary_focus": "この資料では、案件の目的、検討理由、次の判断事項を営業説明しやすい順に整理します。",
        "secondary_focus": [
          "Customer context confirmationを確認する"
        ]
      },
      "input_fingerprint": "e9ec884017e04f8fda8052cdb3a1a16d84bec568",
      "input_metrics": {
        "checklist_item_count": 1,
        "comparison_basis_present": true,
        "hierarchy_basis_present": false,
        "image_evidence_present": false,
        "missing_evidence_count": 0,
        "numeric_claim_count": 0,
        "required_evidence_count": 1,
        "supporting_message_count": 1,
        "time_sequence_present": true,
        "total_text_chars": 149
      },
      "intent_confidence": "high",
      "intent_id": "intent-deck-plan-0ee17cfe60a9-deck-plan-0ee17cfe60a9-slide-00-cover-e9ec884017",
      "layout_constraint": [
        "keep_single_message",
        "no_layout_generated",
        "image_placeholder_only"
      ],
      "reading_order": "center_out",
      "rendering_hint": "Show the slide as hero communicating frame_decision without generating coordinates, fonts, colors, or PowerPoint objects. Visual Director may consider image_placeholder.",
      "schema_version": "pe2_slide_intent_v1",
      "slide_blueprint_id": "deck-plan-0ee17cfe60a9-slide-00-cover",
      "slide_intent": "frame_decision",
      "slide_intent_version": "pe2_slide_intent_v1",
      "slide_order": 0,
      "slide_type": "cover",
      "source_evidence_ids": [
        "ev-deck-plan-0ee17cfe60a9-slide-00-cover-01"
      ],
      "source_message_design_id": "msg-deck-plan-0ee17cfe60a9-deck-plan-0ee17cfe60a9-slide-00-cover-60073de2",
      "validation_result": {
        "issues": [],
        "valid": true
      },
      "visual_pattern_candidate": "hero",
      "warnings": []
    },
    {
      "chart_candidate": "none",
      "connected_to_runtime": false,
      "created_at": "2026-07-27 00:00:00+00:00",
      "deck_id": "deck-plan-0ee17cfe60a9",
      "diagram_candidate": "callout",
      "evaluation_result": {
        "blocking_issue_count": 0,
        "dimensions": [
          {
            "issues": [],
            "max_score": 10,
            "name": "Intent Clarity",
            "reason": "Slide Intent must say what the viewer should understand or decide.",
            "recommendations": [],
            "score": 10
          },
          {
            "issues": [],
            "max_score": 10,
            "name": "Visual Readiness",
            "reason": "Slide Intent should provide enough abstraction for Visual Director to choose a visual pattern.",
            "recommendations": [],
            "score": 10
          },
          {
            "issues": [],
            "max_score": 10,
            "name": "Information Hierarchy",
            "reason": "Primary focus, secondary points, and muted content should be clearly separated.",
            "recommendations": [],
            "score": 10
          },
          {
            "issues": [],
            "max_score": 10,
            "name": "Reading Flow",
            "reason": "Reading order should describe how information should be scanned before rendering.",
            "recommendations": [],
            "score": 9
          },
          {
            "issues": [],
            "max_score": 10,
            "name": "Evidence Compatibility",
            "reason": "Visual intent must respect evidence gaps and avoid hiding missing proof.",
            "recommendations": [],
            "score": 10
          },
          {
            "issues": [],
            "max_score": 10,
            "name": "Message Compatibility",
            "reason": "Intent should be traceable to Message Designer output.",